,Summary,Adventure,Angst,Drama,Family,Friendship,Humor,Hurt_Comfort,Romance
431,"Sequel to ‘My Little Aibou.’ Yami and Yugi have settled into their new lifestyle as father and son, but their enemy comes back, and this time presents Yugi with a challenge that may be impossible…",0.0,0.0,1.0,0.0,0.0,0.0,0.0,0.0
432,"Ryou Shiozu looks at life through his camera. It's the safest place for him to be. So when the official dare devil of his new school - Bakura - takes an interest in him, will Ryou step out from behind the lens and really look at life? And love? Tendership",0.0,0.0,0.0,0.0,1.0,0.0,0.0,1.0
433,Kaiba's doing a psychology project His subject? Joey Wheeler. Read as we learn some little secrets about our blonde duellist and if you don't want to you could always laugh at the CEO who's an equivalent to the Hiroshima atom bomb when he's near a kitchen,0.0,0.0,0.0,0.0,0.0,1.0,0.0,1.0
434,AU.Yugi was a happy carefree boy with loyal friends and his love for games.That was until Yami Atemu transferred to his school .The guy had openly shown his disliking to him the moment they first talked.Or so Yugi thought.What is his problem?YxY. Bonus chapter added.,0.0,0.0,0.0,0.0,1.0,0.0,0.0,1.0
435,A conversation between two good friends Yuugi and Jounouchi about the ins and outs of their respective partnerships. YxYY and JxS,0.0,0.0,0.0,0.0,0.0,1.0,0.0,1.0
436,Three months ago Yami erased Yugi and Ryou's memory of everything with Yami and Bakura just to make sure they wasn't in pain when Yami and Bakura was gone. Now both Yami and Bakura is back and they only have FIVE DAYS to get Yugi and Ryou to remember them,0.0,0.0,0.0,0.0,0.0,0.0,0.0,1.0
437,"Goku, Vegeta and the Demi-Saiyans all have their tails back, but bad timing for Gohan seeing as how Videl has no idea about a Saiyan tail. Involves Sharpner getting poked in the eye, a hyperactive Goten and Gohan... purring? Post Buu",0.0,0.0,0.0,0.0,0.0,1.0,0.0,1.0
438,"No parent should ever have to bury their child. No loss can ever compare. No full return to normalcy is ever possible. But...perhaps forgiveness can still exist amid all the despair. [AU where Gohan dies against Cell, instead of Goku] [GoChi]",0.0,0.0,0.0,1.0,0.0,0.0,1.0,0.0
439,"Trunks returns to destroy the androids and take back his world. However, we all know he's the only fighter left. With threats like Broly, Buu, Janemba, and more down the road, he's going to need unwanted help. Eventual possible romance. Have not decided.",1.0,0.0,0.0,0.0,0.0,0.0,0.0,1.0
440,"Master Roshi said it best: Saiyans certainly do pick the strangest wives. A few snapshots of our favorite warriors' unconventional relationships. *Vegeta/Bulma, Goku/Chichi, Gohan/Videl, Trunks/Goten*",0.0,0.0,0.0,0.0,0.0,1.0,0.0,1.0
441,AU First fanfic A temporary change of command brings unexpected changes to the Saiyan team. RaditzxOC.,1.0,0.0,0.0,0.0,0.0,0.0,0.0,1.0
442,"The night before Future Trunks goes back to his original timeline, he is determined to finally have that conversation he's been yearning to have with his father. Complete one-shot.",0.0,1.0,0.0,1.0,0.0,0.0,0.0,0.0
443,Because some traditions are too much fun to be left alone!,0.0,0.0,0.0,1.0,0.0,1.0,0.0,0.0
444,"Videl just can't take his smiles. They make her crave for something more than the shallow fleetingness of 'teen love,' because god, it was practically an oxymoron.",0.0,0.0,0.0,0.0,0.0,1.0,0.0,1.0
445,One year after Juu returns to Earth. Can the Z-fighters handle the threat of the androids? What will Juu's choise be? Join the androids or help Gohan? Sequel to 'A Different Gohan',0.0,0.0,1.0,0.0,0.0,0.0,0.0,1.0
446,"ONESHOT. As a result of a prank, Gohan and Videl are glued together. How will they deal with this embarrassing situation?",0.0,0.0,0.0,0.0,0.0,1.0,0.0,1.0
447,"What if Gohan had listened to his father and killed Cell before he self-destructed? A fight ends as it should have. An alternative take on the ending of the Cell Games, which produces an AU timeline that will serve as a foundation for some future fan-fictions.",0.0,0.0,1.0,0.0,0.0,0.0,0.0,0.0
448,"Sometimes a promise means the world to someone. Sometimes you don't even know what you're promising. This is exactly what happens to 2 teenagers that get together because of a promise made back when they were innocent kids whose existence was unknown to the world. There's just one problem though, their worlds are way too different from each other. G/CC.",0.0,0.0,0.0,0.0,1.0,0.0,0.0,1.0
449,COMPLETE - Vegeta's a rockstar and Bulma's in college. Vegeta fell for the girl in his concert. But this girl has a big grudge on him. She goes out with him to get her revenge. But what if her plan backfired becuase she fell in love with him?,0.0,0.0,0.0,0.0,0.0,1.0,0.0,1.0
450,"After a night of intense 'special training' with Vegeta, Bulma starts feeling a bit insecure when she questions just how did he become so 'experienced'. How will she be able to sleep without some reassurance? Set sometime after Buu. Oneshot.",0.0,0.0,0.0,0.0,0.0,0.0,1.0,1.0
451,"[Complete] Mirai timeline. Bulma used up all her tears after Son died even after finding the bodies of Yamucha and her other friends, her eyes are dry. But when Vegeta goes missing, Bulma just might need to cry again . . .",0.0,1.0,1.0,0.0,0.0,0.0,0.0,0.0
452,"Years after his death, Raditz thinks about Goku's life through the Cell Games. Raditz's take on Goku's battles. One-Shot.",0.0,1.0,0.0,1.0,0.0,0.0,0.0,0.0
453,Goku did always adore his wife's long black hair. A fluffy Goku/Chichi one-shot. Takes place somewhere before the androids arrive.,0.0,0.0,0.0,0.0,0.0,0.0,0.0,1.0
454,The ladies get themselves in over their heads with a Thanksgiving wager!,0.0,0.0,0.0,1.0,0.0,1.0,0.0,0.0
455,Trunks is scheduled to have an after school conference with his mom and teacher and he is really not looking forward to it. Could it be because the Half-Saiyan kindergartener has landed himself into some sort of trouble? And why is Bulma running so late to the meeting? One-Shot.,0.0,0.0,0.0,1.0,0.0,0.0,0.0,0.0
456,One simple action can have far reaching consequences. A wife won't have to raise two children by herself. Her oldest son won't have to be the man of the house so early into adolescence. His younger brother won't have to grow up never knowing his father. Takes place during the Cell Games. Goku lives. Sequel up.,0.0,0.0,1.0,1.0,0.0,0.0,0.0,0.0
457,"He doesn't know why or how, but ever so often he wakes up on a strange planet in the body of a blue haired woman. If that wasn't bad enough, while he's there she's taking his place, royally screwing up his life. He's going to find her, one day, and when he does, she's going to pay. /complete",0.0,0.0,0.0,0.0,0.0,1.0,0.0,1.0
458,"What if Gohan had said 'yes' when Videl asked him whether he liked her with short hair? What would her reaction be? Well, Gohan is about to find out. DBZ. GV. One Shot. COMPLETE",0.0,0.0,0.0,0.0,0.0,0.0,0.0,1.0
459,"Remember how Chi-Chi knitted a sweater for Goku while he was recovering in the hospital? She finally gives it to him, and surprises house guest Piccolo with one during their three year training before the androids arrive! But what does the Namek think of it? (Complete)",0.0,0.0,0.0,1.0,0.0,1.0,0.0,0.0
460,"Gohan and Videl were going on their day at school as usual, until a strange man appeared, and offers to take them four hundred years into the future. Only to find out history was recorded a little differently then what the both of them expected. And they have quite the adventure together. Rated T for some slightly naughty scenes, and the occasional strong language.",1.0,0.0,0.0,0.0,0.0,0.0,0.0,1.0
461,"AU. Handsome or not, he wasn't getting away with this. She pointed an angry finger to the sign behind her. ""Sorry, bud. One per customer."" Goku and Chi-Chi-ness. One-shot. (Complete)",0.0,0.0,0.0,0.0,0.0,1.0,0.0,1.0
462,Sequel to Trusted One. The wedding. One-shot bonus.,0.0,0.0,0.0,0.0,0.0,1.0,0.0,1.0
463,"Call me a sellout, but I actually did it. Grinz Here we have a story set in the original timeline where Goku dies of the heart virus. Here's the goodbye...and the lives of the remaining characters afterwards. Also, something that can be loosely called r",0.0,0.0,1.0,0.0,0.0,0.0,0.0,1.0
464,"When Bra comes home past curfew one night, what will Vegeta's fatherly instincts tell him to do? *One-Shot*",0.0,0.0,0.0,1.0,0.0,0.0,0.0,0.0
465,"Even after Majin Buu's defeated, Videl Satan still wants Gohan to train her, and Gohan willingly accepts. But not because everyone keeps insinuating about their 'relationship'. Oh no. And it's definitely not because he likes her...right? One-shot.",0.0,0.0,0.0,0.0,0.0,0.0,0.0,1.0
466,"After a bit of controversy, Capsule Corps. Heiress, Bulma Briefs, publicly announces to the world that her husband,Vegeta, is...infact...an alien. After Buu setting. Slight humor. Oneshot. Please R&R.",0.0,0.0,0.0,0.0,0.0,1.0,0.0,0.0
467,"Sequel for I Married an Alien. After Goku realized Chi-Chi was with child before the Cell Games started, his decision on being resurrected has changed so that he remains among the living. But was it the right choice after all? One-shot.",0.0,0.0,0.0,1.0,0.0,0.0,0.0,0.0
468,"Trunks is sure there is something hiding in his closet, and who better to fight off the monster then his father, right?",0.0,0.0,0.0,1.0,0.0,1.0,0.0,0.0
469,Krillin comes up with a much easier way of getting rid of Cell.,0.0,0.0,0.0,0.0,0.0,1.0,0.0,0.0
470,"Power... is having the strength to take someone's life... and choosing not to, Brolli.' Who would have thought that it'd be a weak little earthling who changed the way he thought? Prequel to New Divide. Read and REVIEW!",1.0,0.0,0.0,0.0,0.0,0.0,0.0,1.0
471,"A heavily researched fanfiction of how Vegeta and Bulma's relationship developed, making the most earnest attempt to be as true to the show and its characters as possible. Takes place between Z Warrior's Prepare and The Androids Arrive.",0.0,0.0,0.0,0.0,0.0,0.0,0.0,1.0
472,"Left alone to deal with the aftermath of Goku's decision to remain in the afterlife, ChiChi is forced with the realization that her husband is not coming back. Where does that leave her, and is there someone who can help her adjust to life without Goku?",0.0,1.0,0.0,0.0,0.0,0.0,1.0,0.0
473,"Set during the Buu Saga, about six months after Kid Buu's defeat. Goku promised Supreme Kai a kiss from an Earth woman, but he left his promise unfulfilled. Now, Supreme Kai has come to Capsule Corporation to get his kiss, if he can make it past Bulma's temper and Vegeta's fury. Vegeta is in for the mental torture of his life. Can his pride possibly survive the humiliation?",0.0,0.0,0.0,0.0,0.0,1.0,0.0,1.0
474,"Not much to summarize here, so I guess you'll just have to read and find out! Just a cute little father-son stuff. Please enjoy and R&R!",0.0,0.0,0.0,0.0,1.0,0.0,0.0,0.0
475,"Cell emerges into the dead world of the future, his only goal is to find the androids and become Perfect. He is assured that his Perfect form is unstoppable, though the wizard Babidi says otherwise. To combat boredom, Cell allies himself with Babidi to revive Majin Buu and receive the one thing he truly desires: A challenge.",1.0,0.0,0.0,0.0,0.0,0.0,0.0,0.0
476,"When Vegeta catches his wife being secretive, what's a Saiyan prince to think, other than the worst? A Christmas Special oneshot based on The Twelve Days Of Christmas.",0.0,0.0,0.0,0.0,0.0,1.0,0.0,1.0
477,"A startling revelation from Vegeta about Saiyan physiology leaves Goten reeling. Now Trunks is stuck trying to convince his boyfriend that he isn't pregnant. For Urikaa. *Truten, Yaoi*",0.0,0.0,0.0,0.0,0.0,1.0,0.0,0.0
478,B&V are Hollywood's hottest couple but until they broke up. But what if they were tricked to sign a binding contract to work with each other? Will they be together again or will they decided not to?,0.0,0.0,0.0,0.0,0.0,1.0,0.0,1.0
479,A young boy's misunderstanding could go a long way...,0.0,0.0,0.0,1.0,0.0,1.0,0.0,0.0
480,"On the night before the Cell Games, as far as Piccolo is concerned all Gohan really needs to clear his head is to be thrown off the lookout. Somehow, it was funnier when there were dinosaurs at the bottom.",0.0,0.0,0.0,0.0,0.0,1.0,0.0,0.0
481,Goku hadn't known that Chi-Chi could sing...he just hoped she wasn't singing about him. Rated for language.,0.0,0.0,0.0,0.0,0.0,1.0,0.0,1.0
482,"""Do you belong to me?"" Such a simple question. Alas, it does not always bring such a simple answer...Chi-Chi x Goku. One shot.",0.0,0.0,1.0,0.0,0.0,0.0,0.0,1.0
483,"Bulma loves Goku. Goku loves Bulma...but Bulma is pregnant with Vegeta's child and Goku is married to Chichi. Is it too late for these two best friends to be together with no regrets between them? Thank goodness for dragonballs! Please read and review, thx!",0.0,0.0,0.0,0.0,0.0,1.0,0.0,1.0
484,PostCell. There might still be something to salvage among the wreckage.,0.0,1.0,1.0,0.0,0.0,0.0,0.0,0.0
485,"Curious Bulma quizzes a rather irritated Vegeta about why he dislikes earth so much, and surprise, surprise he has a top ten reasons! Bulma decides to counter with her top ten reasons why he actually likes Earth. *30kisses - theme #10* *oneshot*",0.0,0.0,0.0,0.0,0.0,1.0,0.0,1.0
486,"Dr. Gero took an integral part of Android 18's humanity when he created her: emotions. No longer able to feel them as a human would, Krillin teaches her that some feelings are deeper and don't have to be faked. K/18.",0.0,0.0,0.0,0.0,0.0,0.0,1.0,1.0
487,Piccolo learns what it means to be alive...after discovering he's going to die.,0.0,0.0,1.0,0.0,0.0,0.0,0.0,0.0
488,"“Gohan,” Chichi began, still calm and patient. “Have I ever told you why I insist that you study so hard?”",0.0,0.0,0.0,1.0,0.0,0.0,0.0,0.0
489,"Troubled with finding a gift for his mother's birthday, Mirai Trunks makes a trip to the past in hopes of having his father help him with it. When he thinks all hope is lost, Trunks finds an interesting figurine that gives him a start...BV!",0.0,0.0,1.0,0.0,0.0,0.0,0.0,1.0
490,Certain shades of make-up don't carry the same meaning for other species.,0.0,0.0,0.0,0.0,0.0,1.0,0.0,0.0
491,Chichi lost her memory and forgot every detail regarding Goku and their son Gohan. How could that happen? And how are they going to restore it? Goku has an idea but is it actually going well? Sweet little story (slight AU) about Goku and Chichi set between DB and DBZ. / Edited version from 04/06/2020,0.0,0.0,0.0,1.0,0.0,0.0,0.0,1.0
492,"With Goku back from the dead, the Son Family can finally be a nice full family of four in their little house in the country. Little moments abound as Goten clings, Gohan asks for girl advice, and Chi-Chi tries to stand back so the boys can form bonds with their father. At least Goku knows how to handle the attention.",0.0,0.0,0.0,1.0,0.0,0.0,0.0,1.0
493,"WARNING: VERY CUTE. Gohan's writing an essay for school and Piccolo drops by. Another one of those chibiGohan loves Mr. Piccolo things. Oh god, the sugar! So sweet! It is rotting my teeth! Arrrgghhh!",0.0,0.0,0.0,0.0,0.0,1.0,0.0,0.0
494,"When Videl makes an unexpected visit to Mount Paozu, Goten answers the door. If only Gohan realised a seven-year-old shouldn't be trusted.",0.0,0.0,0.0,0.0,1.0,1.0,0.0,0.0
495,"A young man gets to live in the world of Akira Toriyama's Dragon Ball! Reborn as a Saiyan, he will attempt to become the strongest of Universe 7, maybe get some wishes granted and become immortal. But his mere existence could cause ripples in time. Mira, Towa, and the Time Patrol are in for a ride. Rated T. Officially discontinued as of 12-3-2021. Revamp coming soon.",1.0,0.0,0.0,0.0,0.0,0.0,0.0,0.0
496,"Raditz has arrived on Earth but not alone, he has brought a small Saiyan child with him a girl no older than Gohan. after recovering Gohan Goku spots Veroca hiding in the bushes, she is alone and Goku finds it acceptable to take her in as his own. This story will be the first season of dbz, the beginning through the saiyan saga.",1.0,0.0,0.0,0.0,1.0,0.0,0.0,0.0
497,"ChiChi and Bulma KNOW that Vegeta and Goku are the straightest men in the universe, until…ONE SHOT",0.0,0.0,0.0,0.0,0.0,1.0,0.0,0.0
498,"Gohan and Videl go to their High school reunion, but nobody knows that they're married, how will their ex-fellow students react?",0.0,0.0,0.0,0.0,0.0,1.0,0.0,0.0
499,"In this fic, Goku and Bulma met up with Pilaf again and ended up losing their memories. *New* Yes! After so long, The Amnesia Saga had been completed. I also redid parts one and three for you. Check it out!",0.0,0.0,0.0,0.0,0.0,0.0,0.0,1.0
500,"Vegeta stood there, almost naked, only a small white towel was wrapped around his waist. When Bulma realised she wanted to tear off the towel, then get rid off her own clothes, she bit the inside of her mouth and hoped that the pain will help erasing those extremely vivid pictures from her mind - Both Bulma and Vegeta fully in character! The story is following them throughout DBZ",0.0,0.0,0.0,0.0,0.0,1.0,0.0,1.0
501,"Son Arata is Goku's and ChiChi's daughter and Gohan's twin sister. When Arata is taken 2 years before the death of Raditz, she is kidnapped and brought to work for the Planet Trade Organization. This is the story of Arata's pain and torcher that she goes through over 16 years. Give this story a chance, please. And Please Review! It'd appreciate the feedback!",1.0,1.0,0.0,0.0,0.0,0.0,0.0,0.0
502,Gohan is worried about his parents' relationship and Goku attempts to show him that some things are not always as they appear.,0.0,1.0,0.0,0.0,0.0,0.0,0.0,0.0
503,"After losing his arm at the Cell Games, Chi-Chi keeps her eldest son close over the next seven years. Itching for freedom, Gohan convinces his mom to let him attend high school in Satan City. Things aren't half bad until one of his classmates decides to get close to him- and for all the wrong reasons.",0.0,0.0,0.0,0.0,0.0,0.0,0.0,1.0
504,"*One-Shot* How much can you find out about a person in two minutes? And what if that person doesn't say a word? As it turns out, Bulma and Vegeta can have a full-blown conversation under just these circumstances. A peak into their unorthodox relationship.",0.0,0.0,1.0,0.0,0.0,0.0,0.0,1.0
505,"Do our actions make us who we are, or are we special deep down? Gohan is a cynical person, he doesn't think it matters as long as people just leave him alone for five damn minutes. A misguided wish changes everything. Expect lots of swearing, dark themes, and a lack of clarity. (1/3)",0.0,1.0,1.0,0.0,0.0,0.0,0.0,0.0
506,"TwoShot. “So you’re Saiyaman, huh?” GhVi, Pre-Blackmail.",0.0,0.0,0.0,0.0,0.0,0.0,0.0,1.0
507,"Nominated for best action adventure at Quills! After being ambushed and kidnapped, Harry and Snape escape... Snape becomes a mentor. No SLASH. AU story starts in the middle of Harry's 5th year. PDF, ebook, mobipocket available on author's homepage!",1.0,0.0,0.0,0.0,0.0,1.0,0.0,0.0
508,"The events of the second task of the Tri-Wizard Tournament will have great and long lasting effects. Join Harry as he comes into his own with the help of family. Events will push pairing together but not instant soul bond. Harry is angry about his treatment by those at school but not betrayal, mainly disagreements. Good but human Dumbles. Rated T for mild language.",0.0,0.0,1.0,0.0,0.0,0.0,0.0,1.0
509,Harry received some useful advice before the third task. The butterfly effect will be going full-speed. Not everyone is happy with the changes. Enjoy,1.0,0.0,0.0,0.0,0.0,0.0,0.0,0.0
510,Harry's childhood comes back to haunt him. A HarryWeasleys bonding fic.,0.0,1.0,0.0,0.0,0.0,0.0,0.0,0.0
511,"Complete. Hermione goes back in time with one mission: to kill Tom Riddle before he comes to power. How hard can it be? Impossible, she realizes, as a love between them grows stronger than anything she's ever known. Now Hermione has a choice to make: Will",0.0,0.0,0.0,0.0,0.0,0.0,0.0,1.0
512,One Shot. AU. A world in which Voldemort wins. And honestly wishes he hadn't. Time travel. Potential future slash.,1.0,0.0,1.0,0.0,0.0,0.0,0.0,0.0
513,"Some investigations in the true performance of his classmates starts Harry on a different path. After all, he was really curious what reason his best female friend could have to try so hard to make people believe that she was the smartest witch. No pairings",1.0,0.0,0.0,0.0,0.0,0.0,0.0,0.0
514,"Harry was left in the Australian outback by his relatives. Rather than dying from exposure, the heat, or any of the many and varied nasties that could have easily killed him, Harry was found. Don't own. COMPLETE.",1.0,0.0,0.0,0.0,0.0,0.0,0.0,0.0
515,What if Harry Potter was sent to Azkaban for killing Cedric Diggory? What if a Hufflepuff questioned his conviction?,0.0,1.0,0.0,0.0,0.0,0.0,0.0,1.0
516,"After the confrontation with Voldemort after the third task of the Triwizard Tournament, Harry doesn't get sad. He doesn't get mad. He gets even.",1.0,0.0,1.0,0.0,0.0,0.0,0.0,0.0
517,"AU, sixth year story; do not follow the last two books! Sick and tired of the way everyone is trying to force him to become Ginny's boyfriend, our hero is seeking for a way to tell everyone what he thinks of them. Alas, things do not turn out the way he thought they would. No pairings.",0.0,0.0,0.0,0.0,0.0,1.0,1.0,0.0
518,"""What your puny mind doesn't understand, Potter, is that she does the paperwork I hate, and I do the dirty work that grates on her Gryffindor sensibilities."" Hermione and Draco have been partners working in the Department for Control and Regulation of Magical Creatures for years, but their comfortable partnership is shaken up when creatures go missing and the Aurors get involved.",0.0,0.0,0.0,0.0,0.0,1.0,0.0,1.0
519,Peter Pettigrew has been captured and Sirius Black has been cleared of all charges. Now he is determined to raise his godson as his dead best friends wanted. Little Potter characters and humor ensues.,0.0,0.0,0.0,1.0,1.0,0.0,0.0,0.0
520,"On patrol, Albus stumbles across an injured student. The effects of that night changes not only his life, but also the lives of Harry Potter and Severus Snape. However, are these changes for the better or the worse?",0.0,0.0,0.0,1.0,0.0,0.0,1.0,0.0
521,"Title pretty much says it all. OotP AU, some swear words. No pairing, though HP/HG is hinted at a little. Harry does what he should have done. Complete for now. Author's Note added!",0.0,1.0,0.0,0.0,0.0,0.0,1.0,0.0
522,"Harry is a teacher at a preparatory school for young wizards and witches, and that is where he meets five-year-old Scorpius Malfoy. His fascination for the boy grows as their bond strengthens through teaching and learning. It isn't long before Draco is drawn into an evolving relationship.",0.0,0.0,0.0,1.0,0.0,0.0,0.0,1.0
523,Harry is in the midst of a final battle when an unexpected spell reveals a bond between Tom Riddle and Harry Potter. Harry struggles to gain Tom's trust while searching for the answers he needs. Who hid his bond? What actually happened that Halloween in Godric's Hollow? TR/HP MPreg Evil!Dumbledore,0.0,0.0,0.0,0.0,0.0,0.0,1.0,1.0
524,Harry is struggling to come to terms with the events of his 5th year. Can he learn to depend on those he considers family and become what he needs to be in order to survive? HG RHr,0.0,0.0,1.0,0.0,0.0,0.0,0.0,1.0
525,10 Minutes can be the difference between the peace and the hell at Hogwarts! AU third year,0.0,0.0,0.0,0.0,0.0,1.0,0.0,0.0
526,Complete. No pairings. Twin:Harry. Fatally ill Harry runs away for years only to return when his twin brother needs him the most. Being discovered he starts to crumble to his illness. Includes Character Death but that isn't the end for him.,1.0,0.0,0.0,0.0,0.0,0.0,0.0,0.0
527,"Soon after rescuing his 7yearold son, Harry, from the abusive Dursleys, Snape starts his teaching career at Hogwarts.Harry finds more ways to surprise his father, and a school full of students. Snape'll have his hands full. Warn:violence,chld abse.",0.0,1.0,1.0,0.0,0.0,0.0,0.0,0.0
528,"This isn't the first time she's been reborn into the body of an infant, but it's definitely the most interesting. (T for any swearing) (Sirius/OC) (I don't own Harry Potter and I never will).",1.0,0.0,0.0,0.0,0.0,0.0,0.0,1.0
529,"Following an accident in his seventh year, Draco loses his eyesight. After Harry elbows his way into Draco's dark world, both boys find themselves in a strange new friendship, and they each learn new ways to see each other … and themselves. [Complete]",0.0,0.0,1.0,0.0,0.0,0.0,0.0,1.0
530,"In the final months of the war, Harry entrusted Ron with a bundle of parchments marked 'just in case'. More than seventeen years later, Teddy accidentally unroots a bit of the past. But once he starts reading, he can't stop.",0.0,0.0,0.0,1.0,1.0,0.0,0.0,0.0
531,"Seventy one year old Harry Potter, Headmaster of Hogwarts is given the choice to once again save the world or to remain and see his entire world disapear. If he choses to save the world he will be sent back in time.",0.0,0.0,0.0,0.0,0.0,0.0,0.0,1.0
532,"The TriWizard Tournament has been revived and the three largest and most prestigious schools in Europe are due to compete - Hogwarts, Beauxbatons and Durmstrang. And in a mark of respect, the newest and smallest school in not only Britain but also all of Europe, has been invited to watch. If only things were that simple.",1.0,0.0,0.0,0.0,1.0,0.0,0.0,0.0
533,"True Love Tattoos. A Weasley Wizard Wheezes Product. True Love Tattoos reach deep into your subconscious mind, marking your skin for up to two weeks with a symbolic representation of your soul mate.",0.0,0.0,0.0,0.0,0.0,0.0,0.0,1.0
534,"What if Harry met Hermione first, and became friends with her, before he met Ron? This story relates Harry's first meeting with Hermione, and continues with the times they meet each other at the beginning of every year. H/Hr",0.0,0.0,0.0,0.0,1.0,0.0,0.0,1.0
