,Summary,Adventure,Angst,Drama,Family,Friendship,Humor,Hurt_Comfort,Romance
837,"After the Sinnoh League had ended, Ash and Dawn set out for the Hoenn Region to visit a certain coordinator in Petalburg City. As a week of fun passed by, Ash slowly discovered that this girl had already captured his heart. Advanceshipping, AaMayL, AshxMay, SatoHaru",0.0,0.0,0.0,0.0,0.0,0.0,0.0,1.0
838,"An Umbreon who nearly lost everything and an abused Espeon walked their own painful paths alone until they met each other near Mount Mortar. Now they face a long healing process as they work to overcome their pasts and move on. The Johto region can be a cruel place, but one trainer will do everything he can to make their lives better on the road to the Silver Conference & beyond.",1.0,0.0,0.0,0.0,0.0,0.0,1.0,0.0
839,"The first annual Championship Ball is coming up soon and May is heading back to Pallet Town to visit some old friends. Advanceshipping, AshMay, SatoHaru",0.0,0.0,0.0,0.0,0.0,0.0,0.0,1.0
840,"After being defeated by the young pokemon trainer Ethan; Red decides to end his life by jumping off of the cliff, thinking that he has nothing left to live for. But he somehow found himself back in Pallet Town, and who is this girl living in his own home? Why can't people see him? (BurningLeafshipping / Luckyshipping)",0.0,0.0,0.0,0.0,0.0,0.0,0.0,1.0
841,"N has been raised to hate Trainers, though forced to become one himself, he still harbors troubled thoughts. Could a young trainer help change his outlook? N x Touya FLUFFIES! Rated T just in case",1.0,0.0,0.0,0.0,0.0,0.0,0.0,1.0
842,"Though a seemingly happy family, Ash leaves Misty and their son Red behind to go on a journey and never returns. Twelve years later, Red, Green and Blue begin their own adventure to find that the world their parents left behind now holds higher stakes than Gym Badges.",1.0,0.0,0.0,0.0,0.0,0.0,0.0,1.0
843,"Pixii Firesong, an orphaned Charmander, forms an Exploration Team with Synth, a shunned Treeko. Follow them on their journey as they learn just how much friendship can heal.",1.0,0.0,0.0,0.0,0.0,0.0,0.0,1.0
844,"[Oneshot] Charmeleon's POV. Charmeleon has a weakness which is very uncommon to his kind. He will soon evolve, but doesn't want to. He thinks of one solution...",0.0,1.0,0.0,0.0,0.0,0.0,0.0,0.0
845,"A fanfic based mostly on the game Pokemon Emerald and revolves around an original character named Alex, May, and many other familiar and original characters. Rated T for the odd PG13ish stuff that pops up every now and then.",1.0,0.0,0.0,0.0,0.0,0.0,0.0,0.0
846,"In the region of Kalos was a certain pokemon researcher. His research was focused on the social dynamics of the Ralts evolutionary line. However, what began as a simple research expedition soon grew to him Learning to understand just what it meant to understand the heart of another.",1.0,0.0,0.0,0.0,0.0,0.0,0.0,1.0
847,"Drew Hayden - Famous singer, May Maple - Ordinary girl. They are complete strangers but end up spending a whole week together. What is May's big secret? And what does Drew think of her? All he knows is that he's become obsessed with this ordinary girl- CS",0.0,0.0,1.0,0.0,0.0,0.0,0.0,1.0
848,"After finally escaping from Giovanni, Mewtwo has a chance to live his life free, and sadly alone... But when fate leads him to something he would have never expected, a female of his own species, his life is turned upside-down... Mewtwo x OC Complete!",0.0,0.0,1.0,0.0,0.0,0.0,0.0,1.0
849,"[ContestShipping Valentine OneShot] As May and Max returned home to Petalburg, May received a letter from her long time Pokemon rival, Drew! When Drew invited May to go to the Petalburg Square on Valentine's Day, what would happen to them?",0.0,0.0,0.0,0.0,0.0,0.0,0.0,1.0
850,"Dragons of Ideals and Truths were once one; forced to battle to defend their respective heroes' beliefs. Now, two different trainers must face their fate and realize that they are so much alike than they could ever imagined... *Focuses gameverse characters and on N and White (I hcanon her game name as White) and the ending has a rather twisted twist than the games*",1.0,0.0,0.0,0.0,0.0,0.0,0.0,1.0
851,"""A-Ash..what are you doing?"" He still didn't move his hand, and Misty made no move to do it for him. ""Proving something to you,"" he said. Misty's eyes furrowed, and then she realized what he was trying to prove.",0.0,0.0,0.0,0.0,1.0,0.0,0.0,1.0
852,"May soon finds the strength to tell Ash how she feels. Ash returns the feelings and they both get married without anyone knowing. With keeping their marriage a secret, certain feelings that other girls have for ash start to surface. RxR please!",0.0,0.0,0.0,0.0,1.0,0.0,0.0,1.0
853,"Ash is betrayed by all those he held dear to him, he runs away to the one place he felt he needed to be: Altomare. There he finds love, new friends and new pokemon, as well as a new adventure waiting in the wings. With all of these changed will Ash still grow to be the man and hero we know he could be?",0.0,0.0,0.0,0.0,0.0,0.0,0.0,1.0
854,"When May is assaulted, she is left with injuries and emotional scars that she doesn't know how to deal with on her own. She turns to the one person she's always been able to trust for help, but now finds it hard to trust at all. Steven/May. HoennChampionShipping. Hurt/Comfort.",0.0,0.0,0.0,0.0,0.0,0.0,1.0,1.0
855,"Sixteen year old Saki sets on on her quest to be the Hoenn League Champion. Though when she meets a man with silver hair, comes face to face with Team Magma and threat of a dangerous Legendary Pokemon will she be able to achieve her dream? StevenxOC Sequel: Return to Unova is now up!",1.0,0.0,0.0,0.0,0.0,0.0,0.0,1.0
856,"[Mainly Contestshipping] May Maple is a famous teen supermodel and the daughter of one of the wealthiest men in the world. This puts her life at risk, so in order to protect her, a decision is made to send her to an ALL BOYS SCHOOL. During her stay she makes friends, frienemies, and falls in love. (Rated T for languages and implications.) [Sorry for the bad summary]",0.0,0.0,0.0,0.0,1.0,0.0,0.0,1.0
857,"-Oneshot- After 5 years without even seeing each other, a freak blizzard trapping Drew and May in a Poke Center together on New Years Eve will bring up feelings probably better left buried. ""Do you believe in fate... "" CS because there's nothing better",0.0,0.0,0.0,0.0,0.0,0.0,0.0,1.0
858,"Like the title says, 365 days, writing, challenge. Self explanatory. A bunch of oneshots based on a new prompt each day for 365 days. Shippings will be contestshipping, ikarishipping, pokeshipping and possibly more! Be prepared for a lot of romance and maybe a dash of humor. I do NOT own the characters. Read, Enjoy and Review please.",0.0,0.0,0.0,0.0,0.0,1.0,0.0,1.0
859,Ash isn't the only one who's surprised when he gets a call from Misty at his latest stop in Kalos. And this conversation certainly wasn't what Misty had in mind when she phoned in.,0.0,0.0,0.0,0.0,0.0,1.0,0.0,1.0
860,"A Riolu's life is changed forever after tragedy strikes his home town. After running away and getting rescued by a Vulpix, will he have the courage to start his new life? Follow the story of Cobalt and his friends as they grow up and face life's challenges.",0.0,0.0,0.0,0.0,1.0,0.0,0.0,1.0
861,It's Ash and Mistys Wedding. From then on its about how Drew and May react to seeing each other there after 8 yrs. Now they are living in the same town old feelings resurface. But there are others to complicate things. MayxBrendanxDrewxOc,0.0,0.0,0.0,0.0,0.0,1.0,0.0,1.0
862,"An AU to the anime. The Johto League has ended, and before Ash can decide what to do next, Professor Oak sends him and Misty to run a special errand in Ecruteak City. Along the way Ash meets new friends and enemies, and his connection to Ho-Oh is revealed. Set ten years before my other Pokemon story, Fire for Ice.",1.0,0.0,0.0,0.0,0.0,0.0,0.0,1.0
863,"Bittersweet tea, Sunflora bouquets, and chocolates shaped like Pikachu heads serve as an ideal method of courtship for idiots like Red. Selection of hour-based prompts from community 24hour themes.",0.0,0.0,0.0,0.0,0.0,1.0,0.0,1.0
864,"What if Ash started his journey in Sinnoh? Also, what if it followed the game of Platinum rather than the anime? Interesting, ain't it? Rated T at chapter 13.",1.0,0.0,0.0,0.0,0.0,0.0,0.0,1.0
865,"Ash sent her a rather insulting Valentine's Day poem via text. Well, she can't let him get away with it, can she? AAML, fluff, texting war, oneshot.",0.0,0.0,0.0,0.0,0.0,1.0,0.0,1.0
866,"Or is it? Green runs into Gold on his way up Mt. Silver to visit Red-and challenges him to ask Red if they're dating. Gold certainly thinks they are. Drabble GreenxRed, GoldxSilver. Rated for language.",0.0,0.0,0.0,0.0,0.0,1.0,0.0,1.0
867,"""I'll come back, so don't cry. This isn't goodbye forever."" He dreams of Touya. But unlike before, Touya does not stare quietly and accept his fate. He runs, and N follows. – NxTouya, implied Originalshipping",0.0,0.0,0.0,0.0,0.0,0.0,1.0,1.0
868,"Comashipping. They're brothers, so it's only natural that Reggie worries about him sometimes. So when Paul begins to have conversations about a boy named Ash, perhaps he doesn't have to worry too much.",0.0,0.0,0.0,1.0,0.0,1.0,0.0,0.0
869,"Ash and Misty get separated from the group when running from Team Rocket. Lost in the woods, what will happen when tempers start to wear thin? A passionate little AAML snapshot.",0.0,0.0,1.0,0.0,0.0,0.0,0.0,1.0
870,"Sort of a retelling of the last half of Battle Frontier, but with Advanceshipping! Starts right after AG159. My first fic on here!",1.0,0.0,0.0,0.0,0.0,0.0,0.0,1.0
871,"Where do we go when we reach the top of the world? To who do we turn when all there are, are those we have forsaken? Who do we fight when there's no-one left to defeat? What do we do when our dreams are done? When this is his life, what can Ash do?",0.0,1.0,0.0,0.0,0.0,0.0,1.0,0.0
872,"While traveling in Unova, Ash starts to miss a certain someone...until he gets a little surprise...",0.0,0.0,0.0,0.0,1.0,0.0,0.0,1.0
873,"AU. Who knew what a life as a celebrity was like? Four girls are writing songs to four guys that they are in love, no, totally obsessed with. How will these girls capture their attention? Will they succeed, or not? CS, PS, IKS & ORS. Inspired story.",0.0,0.0,1.0,0.0,0.0,0.0,0.0,1.0
874,They were always trying to steal Pikachu – and were laughed at for their failures. But what happens when they finally succeed? Do they really realize just what kind of bond they're breaking – and about the hate they invoke in a hero?,0.0,0.0,0.0,0.0,1.0,0.0,1.0,0.0
875,"When a female Pikachu visits the gang, Pikachu develops a crush on it, which makes Buneary jealous. However, the wild Pikachu is not what it seems. Also, Team Rocket manages to get a lot of money and they're going to use it to catch Pikachu. Question is, what are they buying?",0.0,0.0,0.0,0.0,1.0,0.0,0.0,1.0
876,"Brock had never seen Dawn with such a serious expression on her face. Just what could the preteen be thinking about? AAML goodness of course. “I can see it now!” Dawn clasped her hands together and giggled. ""It would be perfect!""",0.0,0.0,0.0,0.0,0.0,1.0,0.0,1.0
877,"The balance of elements is upset. Amid a violent thunderstorm, a human finds himself transformed into a Squirtle. With the help of a journeying Cyndaquil, he chooses to take balance into his own claws in a new world of uncertainty and danger.",1.0,0.0,0.0,0.0,1.0,0.0,0.0,0.0
878,"Oneshot: ""I'm not gay,"" Ash cried. Misty's response: ""prove it"". AAML.",0.0,0.0,0.0,0.0,0.0,1.0,0.0,1.0
879,"A mysterious illness befalls Ash, but is it more than it seems?",0.0,0.0,0.0,0.0,0.0,0.0,1.0,0.0
880,"Ash faces the Sinnoh League with the support of all his friends and all the Pokemon he has ever caught. Advanceshipping, Cavaliershipping, Orangeshipping, but starts with Pearlshipping. Tell me what you think, it's my first fanfic :) DISCLAIMER: I DON'T OWN POKEMON (Don't wanna write that in every chapter, haha ;) )",1.0,0.0,0.0,0.0,0.0,0.0,0.0,1.0
881,"A series of one shots based on Pokémon Special the manga. Each chapter features one main pairing, from Red & Blue, Gold & Crystal, Ruby & Sapphire, Diamond & Platinum, Black & White, Rakutsu & Faitsu, and X & Y. Resurrected and continuing, and now also featuring Sun & Moon! Discontinued.",0.0,0.0,0.0,0.0,0.0,0.0,0.0,1.0
882,LaRousse and Petalburgh High School have been rivals at everything ever since the beginning of time especially when it comes to football. So how does the star of the LaRousse football team fall for the Petalburgh head cheerleader? Who knows? Please R&R!,0.0,0.0,1.0,0.0,0.0,0.0,0.0,0.0
883,"Do opposites really attract? Find out as Ruby and Sapphire discover why indeed they have been fated together, as Pearl, Diamond and Platina tumble into their lives. Franticshipping? Or a whole new web of fated attraction? Read to find out!",0.0,0.0,0.0,0.0,0.0,1.0,0.0,1.0
884,"Ash is forced to join Hunter J as her apprentice in crime. He will have to leave behind his family and friends in order to protect them. He will looses his honor, and possibly the heart of the one he loves. How will he survive this experience?",1.0,0.0,0.0,0.0,0.0,0.0,0.0,0.0
885,"Exploring Snowpiont Mountain sounded like fun, but Ash wasn't prepared for a freak snowstorm to suddenly appear. Even worse, Pikachu is lost. While searching, someone unexpected comes to the rescue. Palletshipping.",1.0,0.0,0.0,0.0,0.0,0.0,0.0,1.0
886,"Ash Ketchum awakes one day in Kalos, but not the one he's use to. In this new world Pokemon not only die in battles, but it is encouraged. With a loyal Fennekin by his side, Ash must defeat the Kalos League in order to escape the world designed to break him, and to lift Yveltal's curse on him. [THERE IS A REWRITE OUT TO THIS STORY CALLED ASHFALL. I recommend you that version :) ]",1.0,0.0,0.0,0.0,0.0,0.0,1.0,0.0
887,"Dawn's on her way to Hoenn, and after losing a bet, Paul has to travel with her. Paul also learns Dawn's secret. Can Paul break her shell? Can he get her to not fear love? Can he do it before evil strikes? Ikari Contest and Pokeshipping also others",0.0,0.0,0.0,0.0,0.0,0.0,0.0,1.0
888,The story of an ordinary boy on an impossible quest in a world that isn't as black and white as he always thought it was.,1.0,0.0,0.0,0.0,0.0,0.0,0.0,0.0
889,"When I woke up in a forest as a pikachu, I had no idea what I had been thrown into, from falling in love with an eevee to the world falling apart beneath my feet. Just the usual life of a pokemon right? My quest has just begun, and although being a rescuer and facing off against clearly delusional foes is fun, the world is in danger, and I intend on saving it. This is my life. -A.",1.0,0.0,0.0,0.0,0.0,0.0,0.0,1.0
891,"Ash and the gang meet up with Mewtwo again, but Giovanni is after him. Will the gang be able to help? Spoiler; this story is about how Ash get's Mewtwo.",0.0,0.0,0.0,0.0,1.0,0.0,0.0,0.0
892,"""But we couldn't see past our own insecurities, flaws, and problems to see what was right in front of our eyes. We had ruined each other's lives."" Surviving high school means obtaining their pokemon licenses, which means they can finally go on their journeys. But that's the easy part. It's surviving each other that scares them. Poke, contest, oldrival, and ikarishipping",0.0,0.0,0.0,0.0,1.0,0.0,0.0,1.0
893,"3rd Installment to Stars Fell on Pallet Town! While Delia and Jay further strengthen their marriage, Ash and Misty are only discovering what being a couple really means. But can they prove to hesitant Delia they can do this?",0.0,0.0,0.0,1.0,0.0,0.0,0.0,1.0
894,"Misty opened her mouth, just about to comment on how he must have a headache from his brain actually trying to form coherent thoughts for once, when Ash finally spoke. ""Mallow made a weird comment to me tonight at dinner. About you, actually. And, um, me. Us."" Pokeshipping, Sun/Moon",0.0,0.0,0.0,0.0,0.0,1.0,0.0,1.0
895,"Third installment in the 'Hearts' Series. Back in Pallet Town, Ash and Dawn are taking a break but the yearning for adventure has them already thinking about what their next one will be. What will it be? Where will they go? All they know is that they will go on it together. New challenges, rivals and Pokemon face our heroes as they try to make their dreams a reality. Pearlshipping.",1.0,0.0,0.0,0.0,0.0,0.0,0.0,1.0
896,Green/Red- originalshipping. This was not how he expected their first kiss to go.,0.0,0.0,0.0,0.0,0.0,1.0,0.0,1.0
897,"A Pokemon trainer and a Gym Leader walk into a bar. Ash and Misty, ten years down the line and neck-deep in things too awkward to say. AAML, futurefic, romance/humor/angst/general wtfery.",0.0,0.0,0.0,0.0,0.0,1.0,0.0,1.0
898,"Wes Ravenfield, an Umbreon who wishes to become the world's greatest treasure hunter, has been failing in trying to find anything to prove his worth. But, upon discovering a sacred idol that could bring about chaos on the world, he will journey throughout Mysto with his brother and ex-girlfriend, along with new friends along the way. As they get closer, secrets will unfold.",1.0,0.0,0.0,0.0,0.0,0.0,0.0,0.0
899,"Giovanni has achieved Champion status in the Indigo League, and is taking over by use of Legendaries. Ash must stop him, or never see his home again. Sequel to Cold Blooded Killers.",1.0,0.0,0.0,0.0,0.0,0.0,0.0,1.0
900,"When a Charmeleon survives a suicide attempt, its trainer finds himself faced with some difficult decisions. Charmeleon's POV. One-shot, sequel to ""Acrophobic"" by EkaSwede.",0.0,0.0,1.0,0.0,0.0,0.0,0.0,0.0
901,"Red has been reigning as champion for thirteen years now, and he can't imagine his life being any different. When an old friend from the past shows up, can she convince him that he's been missing out on experiencing the rest of the world? Maybe a friendly bet is all the convincing he'll need to take a moment and rethink his life. BurnLeafshipping.",0.0,0.0,0.0,0.0,0.0,0.0,0.0,1.0
902,"New trainer James Burton is on a journey to compete in the Kanto League. Joined by his new friends, Livvi Weston and Richard Winter, James travels the Kanto region, catching pokémon and competing to earn the badges that will get him to the Indigo Plateau.",1.0,0.0,0.0,0.0,1.0,0.0,0.0,0.0
903,"Ikari, hints of others - Dawn's liked Ash for a while now, but falls for ignorant, obsessive Paul when she finds a softer side. Things look ugly when Drew fights for her; can Ikari love pull through? T for heavy romance and dark suggestions. Complete.",0.0,0.0,1.0,0.0,0.0,0.0,0.0,1.0
904,"Why Giovanni was found in Delia Ketchum's house is beyond Ash's comprehension. When Ash discovers that Giovanni is his father, he isn't sure how to handle it. He definitely isn't sure that he wants to hear about his parent's past or that his childhood is a lie. Diamondshipping",0.0,0.0,0.0,1.0,0.0,0.0,0.0,1.0
905,"Ash and Latias have finally settled down in Pallet town, but fate would have it otherwise. Roped in by his old rival, Ash adventures to a region he is unfamiliar with to perform research on a phenomenon known as Mega Evolution. However, Mega Evolution is not all that awaits him in Kalos.",1.0,0.0,0.0,0.0,0.0,0.0,0.0,1.0
906,"After the doors were closed, Riku has been in the shadows but in the shadows,there is no such thing as time because time is meaningless. So what happens when Sora opens the door five years later? SoraxRiku & SephxCloud YAOI",0.0,0.0,1.0,0.0,0.0,0.0,0.0,1.0
907,"During the events of CoM/Days, everyone forgets about Sora...including his parents. A sequel to ""Islands Like Glass Towers.""",0.0,1.0,0.0,0.0,0.0,0.0,0.0,0.0
908,"On a mission Sora, Riku and Kairi must rescue an unknown Keyblade master from the Void. However, how is it that from her past all she remembers is Sora? Strange memories begin to enter his mind, but are they his or of the sleeping boy who's connection is still unknown to him?",1.0,0.0,0.0,0.0,0.0,0.0,0.0,0.0
909,"Set just after the end of KHII. There were things that Sora himself remembered, and there were memories that were not entirely his own. And he decided to honor one of those memories.",0.0,0.0,0.0,0.0,1.0,0.0,0.0,0.0
910,“You did what with Roxas in your dream?” In which Kairi attempts to help Sora with a problem. [Sora x Roxas] [oneshot],0.0,0.0,0.0,0.0,0.0,1.0,0.0,1.0
911,"As Hayner and Seifer edge their way into a new friendship and away from beating each other senseless, Hayner quickly finds out that the bully is spectacularly overprotective of him and just doesn't understand why. Slash, SeiferxHayner, Seiner.",0.0,0.0,0.0,0.0,0.0,0.0,1.0,1.0
912,"They have an objective. Now all they need is venture capital, a bit of luck — and a better plan than panhandling. All good things must come to an end: So too all things mediocre.",0.0,0.0,0.0,0.0,0.0,1.0,0.0,0.0
913,"White and Black. Light and Darkness. Good and Evil. The lines between always looked so clear. Until Sora, a champion of Light, is pushed into Darkness. Now, everything's changed. A new battle looms, unlike any other. The question is, which side is right?",1.0,0.0,0.0,0.0,0.0,0.0,0.0,1.0
914,She just happened to pick a guy that would make her mornings worthwhile.,0.0,0.0,0.0,0.0,0.0,1.0,0.0,1.0
915,"When darkness threatens to cover the lands once more, five young Keyblade wielders must band together to save the worlds before an ancient evil is resurrected! Based on the YouTube group of the same name.",1.0,0.0,0.0,0.0,0.0,0.0,0.0,0.0
916,"[RikuSora, Yaoi, possibly disturbing content] Riku would keep Sora in a box... keep the boy tucked away where only he can find him.",0.0,0.0,0.0,0.0,0.0,0.0,0.0,1.0
917,"Vanitas was supposed to have merged with Ventus after his defeat in the Keyblade Graveyard, yet here he was, and now he has a stowaway. Sora had bound his heart to Vanitas', and the Guardians of Light were going to help evict him. Whether they wanted to or not. Sora had opened his heart to protect so many people. Now, it was time that someone finally paid him back.",1.0,1.0,0.0,0.0,0.0,0.0,0.0,0.0
918,She’d embrace the night because he was in her arms again. [SoraKairi],0.0,0.0,0.0,0.0,0.0,0.0,0.0,1.0
919,"Someday, I thought I would be loved. Ha. For people like me, someday never comes.",0.0,0.0,0.0,0.0,0.0,0.0,1.0,1.0
920,Looking in on the good life I might be doomed never to find. Riku/Sora. Post-KH2. Another look at possible consequences of the events portrayed in the games.,0.0,1.0,0.0,0.0,0.0,0.0,0.0,1.0
921,"Female teenager Sora has always wanted to go explore other worlds with her best friends,Riku and Kairi-except they get separated in the process. In a journey to find her precious friends, Sora slowly matures as she comes to understand her responsibilities of having the title of ""keybearer"" and juggles to protect those dear to her. (Genderswitch Princesses of Heart)",1.0,0.0,0.0,0.0,1.0,0.0,0.0,0.0
923,[AU. Sequel to Silentium.] Silentium had always been more than just a scar on his back; more than just a horrid vow. It's just a shame Sora and his friends didn't see that until now.,0.0,1.0,0.0,0.0,0.0,0.0,1.0,0.0
924,"Terra/Aqua. Terra returns to Olympus to find that he's now a big name brand. Complete with rabid fangirls. With no other hope for salvation, he begs Aqua to protect him. As his fiancee.",0.0,0.0,0.0,0.0,0.0,1.0,0.0,1.0
925,"It doesn't end with Kingdom Hearts. It goes on. [KHII LJ challenge, RikuSoraKairi]",0.0,0.0,0.0,0.0,0.0,1.0,0.0,1.0
926,"RN; — Roxas and Namine, sitting in a tree. —•eCZi",0.0,0.0,0.0,0.0,0.0,1.0,0.0,1.0
927,"Sora and Cloud run into each other after their fight in the Coliseum. He may leave, but he will never forget... [oneshot] [SoraCloud]",0.0,0.0,0.0,0.0,0.0,0.0,0.0,1.0
928,Sora doesn't need Roxas to wake up at the beginning of KH2. But that doesn't mean Sora doesn't need Roxas at all. AU of Kingdom Hearts II. Ignores KH3D.,0.0,0.0,0.0,0.0,0.0,0.0,0.0,1.0
929,"Sora and Kairi study careers, and have a presentation in front of the class on their future plans. Of course, Riku is involved. [Sora x Kairi x Riku]",0.0,0.0,0.0,0.0,0.0,1.0,0.0,1.0
930,"Nine years. Terra, I'm still waiting for you three. You swore you'd come back to me. That it will all go back to the way it was. Xehanort! He stole everything from me! Mickey, Yensid, and Merlin - they would see me dead! And now there is a new Keyblade Wielder! Fine. He won't stop me! No one will! Let them come! I will get my friends back. And I'll crush anyone who gets in my way!",1.0,0.0,0.0,0.0,0.0,0.0,0.0,1.0
931,"Their friendship was forged by a simple AngelMortal game, and never did Leon think that the same game would drive a wedge between them. Or maybe he’s just jealous that Cloud’s paying way too much attention to his new mortal. LxC",0.0,0.0,1.0,0.0,0.0,0.0,0.0,1.0
932,"Roxas and Axel are stubborn princes from neighboring kingdoms, engaged young and far from happy about it. Who would have thought one little spark of magic could change their worlds completely? Based on Swan Princess",0.0,0.0,0.0,0.0,0.0,0.0,0.0,1.0
933,The harsh realities of high school...can a popular and an outcast over come them to be together? Can they go against everything and everyone? What happens when people try to tear them apart? Will they make it or aren't their feelings strong enough?,0.0,0.0,1.0,0.0,0.0,0.0,0.0,1.0
934,"Roxas… It was never about dying, this story, our story, it wasn’t about me dying. It’s about living. Rox, you can’t spend your life waiting to die. You have to live. For me. Your life isn’t over yet. Just mine. .Akuroku. .Character Death.",0.0,0.0,0.0,0.0,0.0,0.0,0.0,1.0
935,"She is a mother, a girl with two beautiful boys to call her own. [RikuSoraKairi, postKH2]",0.0,1.0,0.0,0.0,0.0,0.0,0.0,0.0
936,"Roxas awakens on a train leading to a new home and life. With no memory of his past, he SHOULD be able to live a normal life in Twilight Town, right? SPOILERS! Written before 358/2 Days existed",1.0,0.0,0.0,0.0,0.0,0.0,0.0,0.0
